,source,author,title,description,url,urlToImage,publishedAt,content
0,"{'id': 'reuters', 'name': 'Reuters'}",,Global recession can be avoided with right fiscal policies -IMF's Georgieva - Reuters,"Global recession can be avoided if governments' fiscal policies were consistent with monetary policy tightening, but likely there would be countries falling into recession next year, the International Monetary Fund's managing director said on Monday.",https://www.reuters.com/markets/asia/global-recession-can-be-avoided-with-right-fiscal-policies-imfs-georgieva-2022-10-03/,https://www.reuters.com/resizer/8W8fki9z-vL-Y0z8vs6bLu1Oiq4=/1200x628/smart/filters:quality(80)/cloudfront-us-east-2.images.arcpublishing.com/reuters/BSI42P6YNNI5XJVOXFQQ4ORW7Y.jpg,2022-10-03T19:22:00Z,"RIYADH, Oct 3 (Reuters) - Global recession can be avoided if governments' fiscal policies were consistent with monetary policy tightening, but likely there would be countries falling into recession n… [+3267 chars]"
1,"{'id': 'reuters', 'name': 'Reuters'}",,Oil extends losses on recession fears - Reuters,"Oil prices dipped in early trade on Friday, extending the week's losses as concern over tight supply was outweighed by escalating fear of sharp interest rate hikes slamming global growth and hitting fuel demand.",https://www.reuters.com/business/energy/oil-extends-losses-recession-fears-2022-09-16/,https://www.reuters.com/resizer/NTtAASgfx7F4PhfB1U0UtI5_7vY=/1200x628/smart/filters:quality(80)/cloudfront-us-east-2.images.arcpublishing.com/reuters/EVKORGJQM5PN3E6ZMFH7QOE6Z4.jpg,2022-09-16T01:21:00Z,"MELBOURNE, Sept 16 (Reuters) - Oil prices dipped in early trade on Friday, extending the week's losses as concern over tight supply was outweighed by escalating fear of sharp interest rate hikes slam… [+1899 chars]"
2,"{'id': 'reuters', 'name': 'Reuters'}",Reuters Editorial,"BoE raises rates, despite likely recession - Reuters","The Bank of England raised its key interest rate to 2.25% from 1.75% on Thursday (September 22) and said it would continue to ""respond forcefully, as necessary"" to inflation, despite the economy probably already being in a shallow recession. Louisa Naks has m…",https://www.reuters.com/video/watch/idOV725522092022RP1,https://static.reuters.com/resources/r/?d=20220922&i=OV725522092022RP1&r=OV725522092022RP1&t=2,2022-09-22T15:16:36Z,"Posted 
The Bank of England raised its key interest rate to 2.25% from 1.75% on Thursday (September 22) and said it would continue to ""respond forcefully, as necessary"" to inflation, despite the eco… [+72 chars]"
3,"{'id': 'reuters', 'name': 'Reuters'}",,IMF sees further slowdown in global economy in third quarter - Reuters,"Downside risks continue to dominate the global economic outlook and some countries are expected to slip into recession in 2023, but it is too early to say if there will be a widespread global recession, IMF spokesman Gerry Rice said on Thursday.",https://www.reuters.com/markets/rates-bonds/imf-sees-further-slowdown-global-economy-third-quarter-2022-09-15/,https://www.reuters.com/resizer/mgUzrgQRgDb4lpHSUmewBttB7tI=/1200x628/smart/filters:quality(80)/cloudfront-us-east-2.images.arcpublishing.com/reuters/3VP5Q4SNYZO2ZLOS7OFBMEIUUE.jpg,2022-09-15T14:52:00Z,"WASHINGTON, Sept 15 (Reuters) - Downside risks continue to dominate the global economic outlook and some countries are expected to slip into recession in 2023, but it is too early to say if there wil… [+1675 chars]"
4,"{'id': 'reuters', 'name': 'Reuters'}",,Sterling dented by modest BoE rate hike - Reuters,"Sterling surrendered gains against the dollar and the euro on Thursday after the Bank of England raised its key interest rate to 2.25% and vowed to ""respond forcefully, as necessary"" to inflation, despite the economy entering recession. <a href=""/markets/euro…",https://www.reuters.com/markets/europe/sterling-dented-by-modest-boe-rate-hike-2022-09-22/,https://www.reuters.com/resizer/HrhaG8Jv61uAHoTjEd_Sof1CD1o=/1200x628/smart/filters:quality(80)/cloudfront-us-east-2.images.arcpublishing.com/reuters/MSK2LPH6VFK3XMNAU5ULTRWMUY.jpg,2022-09-22T11:34:00Z,"LONDON, Sept 22 (Reuters) - Sterling surrendered gains against the dollar and the euro on Thursday after the Bank of England raised its key interest rate to 2.25% and vowed to ""respond forcefully, as… [+1206 chars]"
5,"{'id': 'reuters', 'name': 'Reuters'}",,German economy to slide into recession - EconMin - Reuters.com,"The German government expects Europe's largest economy to slide into recession next year as an energy crisis, rising prices and supply bottlenecks take their toll, its economy minister said, <a href=""/markets/europe/exclusive-germany-slide-into-recession-next…",https://www.reuters.com/markets/europe/german-economy-slide-into-recession-econmin-2022-10-12/,https://www.reuters.com/resizer/oU9m0CHehHHcYd4AldxrHiLLdJg=/1200x628/smart/filters:quality(80)/cloudfront-us-east-2.images.arcpublishing.com/reuters/5NOIUQE2OZKZHAHSWQV6MJ2VXY.jpg,2022-10-12T11:35:00Z,"BERLIN, Oct 12 (Reuters) - The German government expects Europe's largest economy to slide into recession next year as an energy crisis, rising prices and supply bottlenecks take their toll, its econ… [+644 chars]"
6,"{'id': 'reuters', 'name': 'Reuters'}",,Column: Copper price slump brings Chinese buyers out in force - Reuters,"While the rest of the world worries about recession, China is steadily increasing its imports of physical copper.",https://www.reuters.com/markets/commodities/copper-price-slump-brings-chinese-buyers-out-force-2022-09-27/,https://www.reuters.com/pf/resources/images/reuters/reuters-default.png?d=111,2022-09-27T14:11:00Z,"LONDON, Sept 27 (Reuters) - While the rest of the world worries about recession, China is steadily increasing its imports of physical copper.
The country's net call on refined copper from the rest o… [+5791 chars]"
7,"{'id': 'reuters', 'name': 'Reuters'}",,"Futures fall on FedEx warning, recession fears - Reuters.com","U.S. stock index futures slipped on Friday, extending falls from overnight, after logistics industry bellwether FedEx withdrew its financial forecast and recession warnings from the World Bank and the International Monetary Fund.",https://www.reuters.com/markets/europe/futures-fall-fedex-warning-recession-fears-2022-09-16/,https://www.reuters.com/resizer/a2VymbMJAsHbCg4j_T_a0AJeEwg=/1200x628/smart/filters:quality(80)/cloudfront-us-east-2.images.arcpublishing.com/reuters/FDDXH5H5I5P2DPFTJHN4PJ67LU.jpg,2022-09-16T09:11:00Z,"Sept 16 (Reuters) - U.S. stock index futures slipped on Friday, extending falls from overnight, after logistics industry bellwether FedEx withdrew its financial forecast and recession warnings from t… [+1411 chars]"
8,"{'id': 'reuters', 'name': 'Reuters'}",,SNB's Jordan can't rule out recession - Blick paper - Reuters,"The Swiss National Bank does not think the Swiss economy will slide into recession but cannot rule the prospect out, SNB Chairman Thomas Jordan said in a newspaper interview published on Friday.",https://www.reuters.com/markets/europe/snbs-jordan-cant-rule-out-recession-blick-paper-2022-09-23/,https://www.reuters.com/resizer/9lqTA_Td3SH_H-jM5BWUIV2Y-uA=/1200x628/smart/filters:quality(80)/cloudfront-us-east-2.images.arcpublishing.com/reuters/CHR4SOW6EBPDNCF4PZTSR5SPSY.jpg,2022-09-23T05:29:00Z,"ZURICH, Sept 23 (Reuters) - The Swiss National Bank does not think the Swiss economy will slide into recession but cannot rule the prospect out, SNB Chairman Thomas Jordan said in a newspaper intervi… [+1361 chars]"
9,"{'id': 'reuters', 'name': 'Reuters'}",,Abu Dhabi leads Gulf declines on recession fears - Reuters,"Abu Dhabi's stock market fell in early trade on Monday, leading declines in the Gulf on investor concern about the prospect of a global recession.",https://www.reuters.com/markets/asia/abu-dhabi-leads-gulf-declines-recession-fears-2022-09-26/,https://www.reuters.com/resizer/MyQoXqb9dWpL6iKgAwg0WFlRbOo=/1200x628/smart/filters:quality(80)/cloudfront-us-east-2.images.arcpublishing.com/reuters/FY4LMVEFAZMQTGMQWUH7KNJFGE.jpg,2022-09-26T08:48:00Z,"Sept 26 (Reuters) - Abu Dhabi's stock market fell in early trade on Monday, leading declines in the Gulf on investor concern about the prospect of a global recession.
MSCI's broadest index of Asia-P… [+1347 chars]"
10,"{'id': 'reuters', 'name': 'Reuters'}",,"BIS backs ""forceful"" rate hikes despite rising recession risk - Reuters","The world's central bank umbrella body, the Bank for International Settlements (BIS), has urged major economies to forge ahead with forceful interest rate hikes despite the growing threat of recessions and currency market volatility.",https://www.reuters.com/markets/europe/global-markets-bis-urgent-2022-09-19/,https://www.reuters.com/resizer/mtjwD8tUXr9yt_2zvhFgLA8poxc=/1200x628/smart/filters:quality(80)/cloudfront-us-east-2.images.arcpublishing.com/reuters/YDXUHLFUPRP4RNSFLEWADBZOR4.jpg,2022-09-19T13:02:00Z,"LONDON, Sept 19 (Reuters) - The world's central bank umbrella body, the Bank for International Settlements (BIS), has urged major economies to forge ahead with forceful interest rate hikes despite th… [+3085 chars]"
11,"{'id': 'reuters', 'name': 'Reuters'}",,Most Gulf bourses drop on recession fears - Reuters,"Most stock markets in the Gulf extended losses on Thursday, after the Federal Reserve sharply hiked U.S. interest rates and projected raising them further and faster than investors had expected in order to tame inflation.",https://www.reuters.com/world/middle-east/most-gulf-bourses-drop-recession-fears-2022-09-22/,https://www.reuters.com/resizer/MyQoXqb9dWpL6iKgAwg0WFlRbOo=/1200x628/smart/filters:quality(80)/cloudfront-us-east-2.images.arcpublishing.com/reuters/FY4LMVEFAZMQTGMQWUH7KNJFGE.jpg,2022-09-22T13:17:00Z,"Sept 22 (Reuters) - Most stock markets in the Gulf extended losses on Thursday, after the Federal Reserve sharply hiked U.S. interest rates and projected raising them further and faster than investor… [+1856 chars]"
12,"{'id': 'reuters', 'name': 'Reuters'}",,"UK downturn deepens, raising recession risk -flash PMI - Reuters UK","The downturn in British businesses steepened this month as they battled soaring costs and faltering demand, according to a survey on Friday that hammered home the rising risk of recession.",https://www.reuters.com/world/uk/uk-downturn-deepens-raising-recession-risk-flash-pmi-2022-09-23/,https://www.reuters.com/resizer/Gx7aXWuja7HuoI17GBoI5n8Xl0A=/1200x628/smart/filters:quality(80)/cloudfront-us-east-2.images.arcpublishing.com/reuters/RSKZJ3QKOBMUXMRH64T3IGV5QE.jpg,2022-09-23T08:36:00Z,"LONDON, Sept 23 (Reuters) - The downturn in British businesses steepened this month as they battled soaring costs and faltering demand, according to a survey on Friday that hammered home the rising r… [+2358 chars]"
13,"{'id': 'reuters', 'name': 'Reuters'}",,"Asia markets spooked by recession risks, dollar climbs - Reuters","Asian share markets slid on Wednesday as surging borrowing costs fed fears of a global recession, spooking investors into the arms of the safe-haven dollar and driving the Chinese yuan to record lows.",https://www.reuters.com/markets/europe/global-markets-wrapup-1-pix-2022-09-28/,https://www.reuters.com/resizer/MwwIEz3I3DZej4lbW7IIS7t70eg=/1200x628/smart/filters:quality(80)/cloudfront-us-east-2.images.arcpublishing.com/reuters/OO5LT6YCHRKQHKS5JJIBQQV3FU.jpg,2022-09-28T02:31:00Z,"SYDNEY, Sept 28 (Reuters) - Asian share markets slid on Wednesday as surging borrowing costs fed fears of a global recession, spooking investors into the arms of the safe-haven dollar and driving the… [+3570 chars]"
14,"{'id': 'reuters', 'name': 'Reuters'}",Reuters Editorial,Stocks slide as global recession fears mount - Reuters.com,European shares slid on Friday (September 16) as recession warnings from two major global financial institutions and bets of a large interest rate hike from the U.S. Federal Reserve next week knocked down sentiment. Julian Satterthwaite reports.,https://www.reuters.com/video/watch/idOV582116092022RP1,https://static.reuters.com/resources/r/?d=20220916&i=OV582116092022RP1&r=OV582116092022RP1&t=2,2022-09-16T12:05:22Z,"Posted 
European shares slid on Friday (September 16) as recession warnings from two major global financial institutions and bets of a large interest rate hike from the U.S. Federal Reserve next wee… [+54 chars]"
15,"{'id': 'reuters', 'name': 'Reuters'}",,Column: Oil investors ready for recession: Kemp - Reuters,Portfolio investors continued to flee from the oil market last week amid multiplying signs of an imminent recession that would cut petroleum consumption.,https://www.reuters.com/markets/commodities/oil-investors-ready-recession-kemp-2022-10-03/,https://www.reuters.com/pf/resources/images/reuters/reuters-default.png?d=114,2022-10-03T11:39:00Z,"LONDON, Oct 3 (Reuters) - Portfolio investors continued to flee from the oil market last week amid multiplying signs of an imminent recession that would cut petroleum consumption.
Hedge funds and ot… [+2607 chars]"
16,"{'id': 'reuters', 'name': 'Reuters'}",,Asian stocks retreat on global recession angst; dollar firm - Reuters,"Asian stocks declined on Friday, extending a global equity slide to a third day, as investors fretted over recession risks amid signs of further aggressive central bank policy tightening.",https://www.reuters.com/markets/europe/global-markets-wrapup-1-2022-10-07/,https://www.reuters.com/resizer/ShppV12UBPZWC1lAEJSxzAbweyk=/1200x628/smart/filters:quality(80)/cloudfront-us-east-2.images.arcpublishing.com/reuters/RUI7LFZEUVKM7PXTMUMUNGMY5M.jpg,2022-10-07T02:05:00Z,"TOKYO, Oct 7 (Reuters) - Asian stocks declined on Friday, extending a global equity slide to a third day, as investors fretted over recession risks amid signs of further aggressive central bank polic… [+3624 chars]"
17,"{'id': 'reuters', 'name': 'Reuters'}",,European shares fall at open as recession risks weigh - Reuters,"European shares fell on Friday, as recession warnings and bets of a large interest rate hike from the U.S. Federal Reserve next week knocked down sentiment.",https://www.reuters.com/markets/europe/european-shares-fall-open-recession-risks-weigh-2022-09-16/,https://www.reuters.com/resizer/UECcQMMznfa4ndakNEswqOsVfu0=/1200x628/smart/filters:quality(80)/cloudfront-us-east-2.images.arcpublishing.com/reuters/5B3R7LND7NLHFFJNHJJ7SRQWTU.jpg,2022-09-16T07:26:00Z,"Sept 16 (Reuters) - European shares fell on Friday, as recession warnings and bets of a large interest rate hike from the U.S. Federal Reserve next week knocked down sentiment.
The continent-wide ST… [+1124 chars]"
18,"{'id': 'reuters', 'name': 'Reuters'}",,"France is not falling into recession, Le Maire says - Reuters",French Finance Minister Bruno Le Maire said on Wednesday that the economy was not facing recession after the government lowered its economic outlook for 2023.,https://www.reuters.com/markets/europe/france-is-not-falling-into-recession-le-maire-says-2022-09-14/,https://www.reuters.com/resizer/vcvBoP-r7_izygn8RhhtJoFDsHA=/1200x628/smart/filters:quality(80)/cloudfront-us-east-2.images.arcpublishing.com/reuters/QTHEJMAY5FKPXNDZU4IZATLEAM.jpg,2022-09-14T07:14:00Z,"PARIS, Sept 14 (Reuters) - French Finance Minister Bruno Le Maire said on Wednesday that the economy was not facing recession after the government lowered its economic outlook for 2023.
Le Maire als… [+1218 chars]"
19,"{'id': 'reuters', 'name': 'Reuters'}",,Druckenmiller sees US falling into recession next year - Reuters.com,Billionaire investor Stanley Druckenmiller said he believes the Federal Reserve’s monetary policy tightening may push the U.S. into a bigger-than-expected recession next year.,https://www.reuters.com/business/finance/druckenmiller-sees-us-falling-into-recession-next-year-2022-09-28/,https://www.reuters.com/resizer/Ls_d8SgCtP3hceb86wcUcaL8sIE=/1200x628/smart/filters:quality(80)/cloudfront-us-east-2.images.arcpublishing.com/reuters/NJAKSAAMSFMEFAYGNHG2LJLS6A.jpg,2022-09-28T16:13:00Z,"Sept 28 (Reuters) - Billionaire investor Stanley Druckenmiller said he believes the Federal Reserves monetary policy tightening may push the U.S. into a bigger-than-expected recession next year.
Spe… [+1168 chars]"
20,"{'id': 'reuters', 'name': 'Reuters'}",,Saudi leads Gulf bourses lower on recession worries - Reuters,"Saudi Arabia's stock market tumbled on Sunday, leading declines across Middle East, in response to Friday's fall in energy prices and on fears that aggressive interest rate hikes by major central banks to tame inflation could cause a global recession.",https://www.reuters.com/markets/asia/saudi-leads-gulf-bourses-lower-recession-worries-2022-09-25/,https://www.reuters.com/resizer/NB58J8lu0yulSdWCM3Ud9Zo07uY=/1200x628/smart/filters:quality(80)/cloudfront-us-east-2.images.arcpublishing.com/reuters/2Z4FHOLK5NN6VDQOK3SFXTSSR4.jpg,2022-09-25T13:16:00Z,"Sept 25 (Reuters) - Saudi Arabia's stock market tumbled on Sunday, leading declines across Middle East, in response to Friday's fall in energy prices and on fears that aggressive interest rate hikes … [+2086 chars]"
21,"{'id': 'reuters', 'name': 'Reuters'}",,European stock index futures fall on mounting recession worries - Reuters,"European stock index futures fell on Wednesday, in line with a sell-off in Asian markets, as a relentless surge in global bond yields and an intensifying energy crisis in the region fuelled worries about a recession.",https://www.reuters.com/markets/europe/european-stock-index-futures-fall-mounting-recession-worries-2022-09-28/,https://www.reuters.com/resizer/lk_Qetmmg5PpBgGSC3Jeo9_U4HY=/1200x628/smart/filters:quality(80)/cloudfront-us-east-2.images.arcpublishing.com/reuters/LQESU2CWJVMV7A4CKS2JKG7QJU.jpg,2022-09-28T06:28:00Z,"Sept 28 (Reuters) - European stock index futures fell on Wednesday, in line with a sell-off in Asian markets, as a relentless surge in global bond yields and an intensifying energy crisis in the regi… [+1311 chars]"
22,"{'id': 'reuters', 'name': 'Reuters'}",,"Futures shackled by rate-hike, recession worries - Reuters","U.S. stock index futures fell on Monday, kicking off another week on softer footing, as investors worried that the Federal Reserve's aggressive push to curb inflation may tip the American economy into recession.",https://www.reuters.com/markets/europe/futures-shackled-by-rate-hike-recession-worries-2022-09-26/,https://www.reuters.com/resizer/XTnyrdDS-dsDiSl6qAJh9f_ph8g=/1200x628/smart/filters:quality(80)/cloudfront-us-east-2.images.arcpublishing.com/reuters/OMPB6PNEDFPEBHRD4ST2RBWIBI.jpg,2022-09-26T11:09:00Z,"Sept 26 (Reuters) - U.S. stock index futures fell on Monday, kicking off another week on softer footing, as investors worried that the Federal Reserve's aggressive push to curb inflation may tip the … [+2140 chars]"
23,"{'id': 'reuters', 'name': 'Reuters'}",,"German economic institutes slash forecasts, see 2023 recession - Handelsblatt - Reuters","Germany's four leading economic institutes have slashed their forecasts for this year and next and now expect Europe's largest economy to slip into recession in 2023, the Handelsblatt daily reported on Monday.",https://www.reuters.com/markets/europe/german-economic-institutes-slash-forecasts-see-2023-recession-handelsblatt-2022-09-26/,https://www.reuters.com/resizer/pgIHjzImDug-6DyZafMsmZUCMJE=/1200x628/smart/filters:quality(80)/cloudfront-us-east-2.images.arcpublishing.com/reuters/XAGYZGSQSJNMRETYMLDFNEVFSA.jpg,2022-09-26T12:39:00Z,"BERLIN, Sept 26 (Reuters) - Germany's four leading economic institutes have slashed their forecasts for this year and next and now expect Europe's largest economy to slip into recession in 2023, the … [+464 chars]"
24,"{'id': 'reuters', 'name': 'Reuters'}",Reuters Editorial,UK nears recession; BoE denies bond buy extension - Reuters.com,"New data Wednesday showed the UK on the brink of recession. Meanwhile, the Bank of England moved to quash speculation it would extend emergency bond buying intended to calm a rout on debt markets. Julian Satterthwaite reports.",https://www.reuters.com/video/watch/idOV172112102022RP1,https://static.reuters.com/resources/r/?d=20221012&i=OV172112102022RP1&r=OV172112102022RP1&t=2,2022-10-12T15:19:21Z,"Posted 
New data Wednesday showed the UK on the brink of recession. Meanwhile, the Bank of England moved to quash speculation it would extend emergency bond buying intended to calm a rout on debt ma… [+35 chars]"
25,"{'id': 'reuters', 'name': 'Reuters'}",,TSX slides to mid-July lows on recession fears - Reuters,"Canada's main stock index slid more than 2% on Tuesday, tracking a fall in global markets as worries about a global recession unnerved investors returning from a long weekend, with energy, technology and financial stocks among to big losers.",https://www.reuters.com/markets/europe/tsx-slides-mid-july-lows-recession-fears-2022-10-11/,https://www.reuters.com/resizer/W-zB51N1c4IOVuxBeMa373uTOvM=/1200x628/smart/filters:quality(80)/cloudfront-us-east-2.images.arcpublishing.com/reuters/WDPD2PWZAZMOHAS5IZID3HPDJY.jpg,2022-10-11T14:40:00Z,"Oct 11 (Reuters) - Canada's main stock index slid more than 2% on Tuesday, tracking a fall in global markets as worries about a global recession unnerved investors returning from a long weekend, with… [+2015 chars]"
26,"{'id': 'reuters', 'name': 'Reuters'}",,"Indian shares fall as IT, automobile decline - Reuters","Indian shares were lower in early trade on Friday, dragged by losses in technology and automobile stocks amid a broader weak sentiment over concerns of a global recession.",https://www.reuters.com/markets/europe/indian-shares-fall-it-automobile-decline-2022-09-16/,https://www.reuters.com/resizer/6TOo7TMpxwzZEbnUxVNIl9WbAis=/1200x628/smart/filters:quality(80)/cloudfront-us-east-2.images.arcpublishing.com/reuters/LIL2SQSVBBI4ZBXK33B6KNJSB4.jpg,2022-09-16T04:15:00Z,"BENGALURU, Sept 16 (Reuters) - Indian shares were lower in early trade on Friday, dragged by losses in technology and automobile stocks amid a broader weak sentiment over concerns of a global recessi… [+1016 chars]"
27,"{'id': 'reuters', 'name': 'Reuters'}",,Euro zone retail sales fall as expected in August - Reuters,"Euro zone retail sales fell in August, data showed on Thursday, pointing to a weakness in consumer demand and underlining expectations of an approaching recession.",https://www.reuters.com/markets/europe/euro-zone-retail-sales-fall-expected-august-2022-10-06/,https://www.reuters.com/resizer/KA0k8IGgsAx8UWMJqIty18OcG7A=/1200x628/smart/filters:quality(80)/cloudfront-us-east-2.images.arcpublishing.com/reuters/OGFFBAECGZKWVH3FKJDQVCWBAY.jpg,2022-10-06T09:13:00Z,"BRUSSELS, Oct 6 (Reuters) - Euro zone retail sales fell in August, data showed on Thursday, pointing to a weakness in consumer demand and underlining expectations of an approaching recession.
The Eu… [+1084 chars]"
28,"{'id': 'reuters', 'name': 'Reuters'}",,"Finland cuts 2023 GDP growth forecast, sees risk of recession - Reuters",Finland's finance ministry on Monday cut its economic growth forecast for 2023 and said the country was at risk of a recession.,https://www.reuters.com/markets/europe/finland-cuts-2023-gdp-growth-forecast-sees-risk-recession-2022-09-19/,https://www.reuters.com/resizer/7bG-sLmRhDCaOIXzIEbIqPCLTA8=/1200x628/smart/filters:quality(80)/cloudfront-us-east-2.images.arcpublishing.com/reuters/ODITHIEUMZJMJH2FR5P5P7YZVI.jpg,2022-09-19T08:11:00Z,"HELSINKI, Sept 19 (Reuters) - Finland's finance ministry on Monday cut its economic growth forecast for 2023 and said the country was at risk of a recession.
The ministry now predicts gross domestic… [+783 chars]"
29,"{'id': 'reuters', 'name': 'Reuters'}",,Column: Hedge funds dump distillates as recession risks intensify: Kemp - Reuters,"Portfolio investors anticipate an imminent recession that will hit consumption of middle distillates such as diesel especially hard, based on recent position changes in futures and options markets.",https://www.reuters.com/markets/commodities/hedge-funds-dump-distillates-recession-risks-intensify-kemp-2022-09-26/,https://www.reuters.com/pf/resources/images/reuters/reuters-default.png?d=111,2022-09-26T11:54:00Z,"LONDON, Sept 26 (Reuters) - Portfolio investors anticipate an imminent recession that will hit consumption of middle distillates such as diesel especially hard, based on recent position changes in fu… [+2626 chars]"
30,"{'id': 'reuters', 'name': 'Reuters'}",,U.S. leading indicator falls for sixth consecutive month in August - Reuters,"A gauge of future U.S. economic activity declined for a sixth straight month in August, potentially signaling a recession amid large interest rate increases from the Federal Reserve.",https://www.reuters.com/markets/us/us-leading-indicator-falls-sixth-consecutive-month-august-2022-09-22/,https://www.reuters.com/resizer/iGSxk9OE08JjDSCCCcOrnveYhoY=/1200x628/smart/filters:quality(80)/cloudfront-us-east-2.images.arcpublishing.com/reuters/HJWVJUHNIZJVHBBFQ74Q56M2BY.jpg,2022-09-22T14:30:00Z,"WASHINGTON, Sept 22 (Reuters) - A gauge of future U.S. economic activity declined for a sixth straight month in August, potentially signaling a recession amid large interest rate increases from the F… [+1059 chars]"
