,source,author,title,description,url,urlToImage,publishedAt,content
309,"{'id': 'reuters', 'name': 'Reuters'}",,C$ slides to 2-year low as Fed eyes higher end-point for rates - Reuters,"The Canadian dollar slumped to a two-year low against its U.S. counterpart on Wednesday before paring its decline, as investors weighed the Federal Reserve's plans to continue raising interest rates to tackle inflation.",https://www.reuters.com/markets/us/c-slides-2-year-low-fed-eyes-higher-end-point-rates-2022-09-21/,https://www.reuters.com/pf/resources/images/reuters/reuters-default.png?d=111,2022-09-21T19:33:00Z,"TORONTO, Sept 21 (Reuters) - The Canadian dollar slumped to a two-year low against its U.S. counterpart on Wednesday before paring its decline, as investors weighed the Federal Reserve's plans to con… [+1838 chars]"
310,"{'id': 'reuters', 'name': 'Reuters'}",,POLL Fed to take rates higher than previously expected; more pain ahead - Reuters,"The Federal Reserve will hike its key interest rate to a much higher peak than predicted two weeks ago and the risks are skewed towards an even higher terminal rate, according to economists polled by Reuters.",https://www.reuters.com/markets/us/poll-fed-take-rates-higher-than-previously-expected-more-pain-ahead-2022-09-28/,https://www.reuters.com/resizer/iGSxk9OE08JjDSCCCcOrnveYhoY=/1200x628/smart/filters:quality(80)/cloudfront-us-east-2.images.arcpublishing.com/reuters/HJWVJUHNIZJVHBBFQ74Q56M2BY.jpg,2022-09-28T12:26:00Z,"BENGALURU, Sept 28 (Reuters) - The Federal Reserve will hike its key interest rate to a much higher peak than predicted two weeks ago and the risks are skewed towards an even higher terminal rate, ac… [+4069 chars]"
311,"{'id': 'reuters', 'name': 'Reuters'}",,BoE's Pill still sees need for 'significant' rates action in November - Reuters,"The Bank of England is still likely to need to make a major change to interest rates next month despite economic uncertainty and market volatility, BoE Chief Economist Huw Pill said on Wednesday.",https://www.reuters.com/markets/currencies/boes-pill-still-sees-need-significant-rates-action-november-2022-10-12/,https://www.reuters.com/resizer/anEfuX98GKopez3zh8y7mk8-jWA=/1200x628/smart/filters:quality(80)/cloudfront-us-east-2.images.arcpublishing.com/reuters/CGLHWRGT2JNADBYOOOHEPZYWAQ.jpg,2022-10-12T11:52:00Z,"LONDON, Oct 12 (Reuters) - The Bank of England is still likely to need to make a major change to interest rates next month despite economic uncertainty and market volatility, BoE Chief Economist Huw … [+697 chars]"
312,"{'id': 'reuters', 'name': 'Reuters'}",,"ECB could hike rates into next year, chief economist says - Reuters.com","The European Central Bank could raise interest rates into next year, chief economist Philip Lane told Irish broadcaster RTE on Saturday, just weeks after two hikes took the deposit rate back into positive territory.",https://www.reuters.com/markets/europe/ecb-could-hike-rates-into-next-year-chief-economist-says-2022-09-17/,https://www.reuters.com/resizer/cFdd5PLtEZ6UYxDLdxG0ciDerQQ=/1200x628/smart/filters:quality(80)/cloudfront-us-east-2.images.arcpublishing.com/reuters/YM7Q7U54RBOJVAB3XJAM6TFCWI.jpg,2022-09-17T17:20:00Z,"A symphony of light consisting of bars, lines and circles in blue and yellow, the colours of the European Union, illuminates the south facade of the European Central Bank (ECB) headquarters in Frankf… [+1175 chars]"
313,"{'id': 'reuters', 'name': 'Reuters'}",,India's RBI may hike rates by 50 bps as inflation accelerates - analysts - Reuters,"The Reserve Bank of India may raise interest rates by another 50 basis points this month after data showed inflation rose further above the central bank's tolerance limit in August, analysts said.",https://www.reuters.com/markets/asia/indias-rbi-may-hike-rates-by-50-bps-inflation-accelerates-analysts-2022-09-13/,https://www.reuters.com/resizer/eNmTKU1ajSfhQc5t3vTiBxatGk4=/1200x628/smart/filters:quality(80)/cloudfront-us-east-2.images.arcpublishing.com/reuters/RAYKQSD7QNNLDPYDHATDVL6FHU.jpg,2022-09-13T04:26:00Z,"MUMBAI, Sept 13 (Reuters) - The Reserve Bank of India may raise interest rates by another 50 basis points this month after data showed inflation rose further above the central bank's tolerance limit … [+1713 chars]"
314,"{'id': 'reuters', 'name': 'Reuters'}",,"Indonesia to raise rates by another 25 bps in Sept, some call for 50 bps - Reuters","Bank Indonesia will follow a surprise August interest rate rise with another 25 basis point hike at its meeting on Thursday, still moving more slowly than most of its peers in trying to bring down inflation, a Reuters poll forecasts.",https://www.reuters.com/markets/asia/indonesia-raise-rates-by-another-25-bps-sept-some-call-50-bps-2022-09-20/,https://www.reuters.com/pf/resources/images/reuters/reuters-default.png?d=111,2022-09-20T01:39:00Z,"BENGALURU, Sept 20 (Reuters) - Bank Indonesia will follow a surprise August interest rate rise with another 25 basis point hike at its meeting on Thursday, still moving more slowly than most of its p… [+2606 chars]"
315,"{'id': 'reuters', 'name': 'Reuters'}",,Norway to hike rates by 50 basis points this week - Reuters poll - Reuters,"Norway's central bank is expected to raise its benchmark interest rate again this week and signal a continued rise in the cost of borrowing in the fourth quarter to combat inflation, a Reuters poll showed on Monday.",https://www.reuters.com/markets/europe/norway-hike-rates-by-50-basis-points-this-week-2022-09-19/,https://www.reuters.com/resizer/ydsdP5HuTfnaOpFgobhy7RFwkVA=/1200x628/smart/filters:quality(80)/cloudfront-us-east-2.images.arcpublishing.com/reuters/PCHXOSWPIBMNNK7FDQ7KBEVWIE.jpg,2022-09-19T11:38:00Z,"OSLO, Sept 19 (Reuters) - Norway's central bank is expected to raise its benchmark interest rate again this week and signal a continued rise in the cost of borrowing in the fourth quarter to combat i… [+1925 chars]"
316,"{'id': 'reuters', 'name': 'Reuters'}",,"ECB may need to lift rates by 75 basis points in Oct, Kazimir says - Reuters","The European Central Bank may need to raise interest rates by another 75 basis points next month as inflation remains unacceptably high, Slovak central bank chief Peter Kazimir told a news conference on Wednesday.",https://www.reuters.com/markets/europe/ecb-may-need-lift-rates-by-75-basis-points-oct-kazimir-says-2022-09-28/,https://www.reuters.com/resizer/EVbZGGJ599_kU9DLkT8g4828Suc=/1200x628/smart/filters:quality(80)/cloudfront-us-east-2.images.arcpublishing.com/reuters/PLX5O57KBNOFHCPHBIDW5JHKPY.jpg,2022-09-28T08:44:00Z,"Sept 28 (Reuters) - The European Central Bank may need to raise interest rates by another 75 basis points next month as inflation remains unacceptably high, Slovak central bank chief Peter Kazimir to… [+486 chars]"
317,"{'id': 'reuters', 'name': 'Reuters'}",,ECB's de Guindos warns of hit to banks from higher rates - Reuters,"Euro zone banks are set for some pain as the economy slows and higher interest rates land some companies in hot water, the European Central Bank vice-president Luis de Guindos said on Tuesday.",https://www.reuters.com/markets/europe/ecbs-de-guindos-warns-hit-banks-higher-rates-2022-09-27/,https://www.reuters.com/resizer/guud9PkU8Uox89S4rXkicq1oLKc=/1200x628/smart/filters:quality(80)/cloudfront-us-east-2.images.arcpublishing.com/reuters/K75DJEZ2ONIN5LBY5QREXCD6AM.jpg,2022-09-27T13:47:00Z,"LONDON, Sept 27 (Reuters) - Euro zone banks are set for some pain as the economy slows and higher interest rates land some companies in hot water, the European Central Bank vice-president Luis de Gui… [+475 chars]"
318,"{'id': 'reuters', 'name': 'Reuters'}",,"RBI to raise rates again, slim majority of economists expect 50 bps hike: Reuters poll - Reuters",The Reserve Bank of India is set to raise interest rates again next week with a slim majority of economists in a Reuters poll expecting a half-point hike and some others expecting a smaller 35 basis point rise.,https://www.reuters.com/markets/asia/rbi-raise-rates-again-slim-majority-economists-expect-50-bps-hike-2022-09-23/,https://www.reuters.com/resizer/pN2x9t3Ngb4m-w4uVK_4rkZdY4o=/1200x628/smart/filters:quality(80)/cloudfront-us-east-2.images.arcpublishing.com/reuters/QBUGYMDBAJP4NEX63CROBEUXTI.jpg,2022-09-23T03:17:00Z,"BENGALURU, Sept 23 (Reuters) - The Reserve Bank of India is set to raise interest rates again next week with a slim majority of economists in a Reuters poll expecting a half-point hike and some other… [+3592 chars]"
319,"{'id': 'reuters', 'name': 'Reuters'}",,"New Zealand's central bank raises rates by 50bp, considered 75bp - Reuters",New Zealand's central bank on Wednesday lifted interest rates to a seven-year high and promised more pain to come as it struggles to cool red-hot inflation in an over-stretched economy.,https://www.reuters.com/markets/asia/new-zealands-central-bank-raises-rates-by-50bp-considered-75bp-2022-10-05/,https://www.reuters.com/resizer/Q76KcTC84M04MhrWYlEdiLRC7RE=/1200x628/smart/filters:quality(80)/cloudfront-us-east-2.images.arcpublishing.com/reuters/IRQXFCCJ5BMB7C55PIXGBNYKSI.jpg,2022-10-05T01:30:00Z,"SYDNEY, Oct 5 (Reuters) - New Zealand's central bank on Wednesday lifted interest rates to a seven-year high and promised more pain to come as it struggles to cool red-hot inflation in an over-stretc… [+1429 chars]"
320,"{'id': 'reuters', 'name': 'Reuters'}",,S. Korea delivers another big hike as Fed rates sink local currency - Reuters,"South Korea's central bank raised interest rates by a half percentage point for a second time since July on Wednesday, as a surging dollar driven by aggressive U.S. monetary policy tightening fanned import inflation.",https://www.reuters.com/markets/asia/s-korea-delivers-another-big-hike-fed-rates-sink-local-currency-2022-10-12/,https://www.reuters.com/pf/resources/images/reuters/reuters-default.png?d=116,2022-10-12T01:11:07Z,"SEOUL, Oct 12 (Reuters) - South Korea's central bank raised interest rates by a half percentage point for a second time since July on Wednesday, as a surging dollar driven by aggressive U.S. monetary… [+1809 chars]"
321,"{'id': 'reuters', 'name': 'Reuters'}",,Colombia's central bank could raise benchmark interest rate further - Reuters,"Further increases to Colombia's benchmark interest rate may be necessary in the coming months as the central bank tries to bring inflation in line with its 3% target, according to minutes from the bank's meeting last week.",https://www.reuters.com/markets/rates-bonds/colombias-central-bank-could-raise-benchmark-interest-rate-further-2022-10-04/,https://www.reuters.com/resizer/dfKyanEOc7nxkd_nT7f0vTaNWXI=/1200x628/smart/filters:quality(80)/cloudfront-us-east-2.images.arcpublishing.com/reuters/YSDDLBIIPVPEZPCJFMFXULGR5U.jpg,2022-10-04T13:05:00Z,"BOGOTA, Oct 4 (Reuters) - Further increases to Colombia's benchmark interest rate may be necessary in the coming months as the central bank tries to bring inflation in line with its 3% target, accord… [+2118 chars]"
322,"{'id': 'reuters', 'name': 'Reuters'}",,UK rate futures switch bets to half-point BoE rate rise - Reuters,"Investors in interest rate futures switched their bets on Friday to narrowly favour a half-point interest rate rise by the Bank of England next week, having earlier this month seen a more than 80% chance that it would raise rates by 75 basis points.",https://www.reuters.com/markets/rates-bonds/uk-rate-futures-switch-bets-half-point-boe-rate-rise-2022-09-16/,https://www.reuters.com/resizer/PVP0ApFtuj2SwckKtmw_dKDWrMk=/1200x628/smart/filters:quality(80)/cloudfront-us-east-2.images.arcpublishing.com/reuters/TGGFM7HDYNOJROFLU7LJ5OQS54.jpg,2022-09-16T13:57:00Z,"LONDON, Sept 16 (Reuters) - Investors in interest rate futures switched their bets on Friday to narrowly favour a half-point interest rate rise by the Bank of England next week, having earlier this m… [+743 chars]"
323,"{'id': 'reuters', 'name': 'Reuters'}",,"Top of ECB rates cycle an open question, ECB's Herodotou says - Reuters","The European Central Bank has expedited its exit from ultra easy monetary policy to bring inflation back to target but it remains open how high interest rates will go, ECB policymaker Constantinos Herodotou said on Wednesday.",https://www.reuters.com/markets/europe/top-ecb-rates-cycle-an-open-question-ecbs-herodotou-says-2022-09-14/,https://www.reuters.com/resizer/CtO3wXRdey7pUpnplnqGyTNHso0=/1200x628/smart/filters:quality(80)/cloudfront-us-east-2.images.arcpublishing.com/reuters/M2BAOBDQT5OF5IQ7EFABWCVGBU.jpg,2022-09-14T10:26:00Z,"NICOSIA, Sept 14 (Reuters) - The European Central Bank has expedited its exit from ultra easy monetary policy to bring inflation back to target but it remains open how high interest rates will go, EC… [+679 chars]"
324,"{'id': 'reuters', 'name': 'Reuters'}",,BoE needs to hike rates next week to calm markets - Deutsche Bank analyst - Reuters,"Britain's central bank needs to make a big inter-meeting interest rate hike as early as next week to calm markets and restore credibility, a Deutsche Bank analyst said on Friday.",https://www.reuters.com/markets/europe/boe-needs-hike-rates-next-week-calm-markets-deutsche-bank-analyst-2022-09-23/,https://www.reuters.com/resizer/4f05PIwgdDiiBSZbUvvppoVwiVc=/1200x628/smart/filters:quality(80)/cloudfront-us-east-2.images.arcpublishing.com/reuters/IG6RAAURWNKYVBAIBWKJ7IDUMY.jpg,2022-09-23T16:02:00Z,"LONDON, Sept 23 (Reuters) - Britain's central bank needs to make a big inter-meeting interest rate hike as early as next week to calm markets and restore credibility, a Deutsche Bank analyst said on … [+949 chars]"
325,"{'id': 'reuters', 'name': 'Reuters'}",,China's smaller banks cut deposit rates to ease margin pressure - Reuters.com,A string of small and mid-sized Chinese banks are following their larger peers and cutting deposit interest rates in the first broad-based move since 2015 to ease pressure on margins after successive lending rate cuts.,https://www.reuters.com/markets/asia/chinas-smaller-banks-cut-deposit-rates-ease-margin-pressure-2022-09-29/,https://www.reuters.com/resizer/3xHhjYrWz4xwpJY3lzaCbIt-qEA=/1200x628/smart/filters:quality(80)/cloudfront-us-east-2.images.arcpublishing.com/reuters/TAZESVLQ5FMORKEK7MGYFXDOLE.jpg,2022-09-29T10:18:00Z,"BEIJING/SHANGHAI, Sept 29 (Reuters) - A string of small and mid-sized Chinese banks are following their larger peers and cutting deposit interest rates in the first broad-based move since 2015 to eas… [+3752 chars]"
326,"{'id': 'reuters', 'name': 'Reuters'}",,"Singapore tightens property market curbs to combat rising rates, demand - Reuters","Singapore unveiled a package of measures for the property market, including tightening the maximum loan quantum limits for housing loans in response to a rise in interest rates, and new steps to moderate demand.",https://www.reuters.com/markets/asia/singapore-tightens-property-market-curbs-combat-rising-rates-demand-2022-09-30/,https://www.reuters.com/resizer/akzZE6WLAJd-i09QGmYa9ckYwrc=/1200x628/smart/filters:quality(80)/cloudfront-us-east-2.images.arcpublishing.com/reuters/TMA7KZYH5JLT5FKESE6H3XM4SQ.jpg,2022-09-30T02:31:00Z,"Sept 29 (Reuters) - Singapore unveiled a package of measures for the property market, including tightening the maximum loan quantum limits for housing loans in response to a rise in interest rates, a… [+2128 chars]"
327,"{'id': 'reuters', 'name': 'Reuters'}",,"RBA to hike rates by 50 bps in October, peak rate pushed higher - Reuters","Australia's central bank will hike interest rates by another half-point on Tuesday and increase borrowing costs further than previously thought in its most aggressive tightening cycle since the 1990s to arrest red hot inflation, a Reuters poll showed.",https://www.reuters.com/markets/asia/rba-hike-rates-by-50-bps-october-peak-rate-pushed-higher-2022-09-30/,https://www.reuters.com/resizer/s7d30HvK8MPLBBuhw6XxLB_4J4U=/1200x628/smart/filters:quality(80)/cloudfront-us-east-2.images.arcpublishing.com/reuters/V66SBGURL5JORNB636O2LQHGQI.jpg,2022-09-30T00:17:00Z,"BENGALURU, Sept 30 (Reuters) - Australia's central bank will hike interest rates by another half-point on Tuesday and increase borrowing costs further than previously thought in its most aggressive t… [+3516 chars]"
328,"{'id': 'reuters', 'name': 'Reuters'}",,Turkey's Erdogan advises central bank to cut rates at next meeting - Reuters.com,"Turkish President Tayyip Erdogan said on Thursday he had advised the central bank to lower its policy rate at its meeting in October, adding that interest rates need to be lowered further.",https://www.reuters.com/markets/europe/turkeys-erdogan-advises-central-bank-cut-rates-next-meeting-2022-09-29/,https://www.reuters.com/resizer/SwQ5cDOogfVFlMeBXXlGTVdkmfI=/1200x628/smart/filters:quality(80)/cloudfront-us-east-2.images.arcpublishing.com/reuters/O7LUUJ77SBK3JGY3EWOGWFNVTI.jpg,2022-09-29T11:11:00Z,"ISTANBUL, Sept 29 (Reuters) - Turkish President Tayyip Erdogan said on Thursday he had advised the central bank to lower its policy rate at its meeting in October, adding that interest rates need to … [+587 chars]"
329,"{'id': 'reuters', 'name': 'Reuters'}",,"ECB should take 'small steps' in raising rates, Centeno says - Reuters","The European Central Bank should take ""as small steps as possible"" in raising its interest rates so as not to destabilise the economy, ECB policymaker Mario Centeno said on Thursday.",https://www.reuters.com/markets/europe/ecb-should-take-small-steps-raising-rates-centeno-says-2022-09-15/,https://www.reuters.com/resizer/p9cH7pS29fBJobU3zHW7MFIXmBs=/1200x628/smart/filters:quality(80)/cloudfront-us-east-2.images.arcpublishing.com/reuters/UE5SHKOVSFIAZLQF7J3EC6XDSU.jpg,2022-09-15T11:57:00Z,"LISBON, Sept 15 (Reuters) - The European Central Bank should take ""as small steps as possible"" in raising its interest rates so as not to destabilise the economy, ECB policymaker Mario Centeno said o… [+519 chars]"
330,"{'id': 'reuters', 'name': 'Reuters'}",,Indonesia c.bank raises rates by 50 bps to head off inflation risks - Reuters,"Indonesia's central bank increased interest rates by more than expected on Thursday as it sought to rein in inflation after the government raised subsidised fuel prices earlier this month, while also supporting the rupiah currency.",https://www.reuters.com/markets/asia/indonesia-cbank-raises-rates-by-50-bps-head-off-inflation-risks-2022-09-22/,https://www.reuters.com/pf/resources/images/reuters/reuters-default.png?d=111,2022-09-22T10:16:00Z,"JAKARTA, Sept 22 (Reuters) - Indonesia's central bank increased interest rates by more than expected on Thursday as it sought to rein in inflation after the government raised subsidised fuel prices e… [+3478 chars]"
331,"{'id': 'reuters', 'name': 'Reuters'}",,"BOJ to keep ultra-low rates, remain global outlier despite weak yen - Reuters",The Bank of Japan is expected to keep interest rates ultra-low on Thursday and reassure markets that it will continue to swim against a global tide of central banks tightening monetary policy to combat soaring inflation.,https://www.reuters.com/markets/asia/boj-keep-ultra-low-rates-remain-global-outlier-despite-weak-yen-2022-09-21/,https://www.reuters.com/resizer/N2D9NBu6ZmI5fdqsazpr491Uwbg=/1200x628/smart/filters:quality(80)/cloudfront-us-east-2.images.arcpublishing.com/reuters/5HSV37TZHZPXLMQJXOHER42JRM.jpg,2022-09-21T21:04:00Z,"TOKYO, Sept 22 (Reuters) - The Bank of Japan is expected to keep interest rates ultra-low on Thursday and reassure markets that it will continue to swim against a global tide of central banks tighten… [+2830 chars]"
332,"{'id': 'business-insider', 'name': 'Business Insider'}","insider@insider.com (Molly Grace,Laura Grace Tarpley, CEPF)","Today's mortgage and refinance rates: October 6, 2022 | Rates dip",Mortgage rates are down today after several weeks of increases. Where rates go next depends in part on the path the Fed takes at its next meeting.,https://www.businessinsider.com/personal-finance/best-mortgage-refinance-rates-today-thursday-october-6-2022-10,https://i.insider.com/628e454f3dbbd20018b72859?width=1200&format=jpeg,2022-10-06T10:00:00Z,"Insider's experts choose the best products and services to help make smart decisions with your money (heres how). In some cases, we receive a commission from our our partners, however, our opinions a… [+6066 chars]"
333,"{'id': 'reuters', 'name': 'Reuters'}",,"JPMorgan, Citigroup to hike prime rate by 75 bps mirroring Fed's move - Reuters","Three major U.S. banks said on Wednesday they will hike their prime lending rates by 75 basis points, bringing the rates to their highest since the global financial crisis of 2008.",https://www.reuters.com/business/finance/jpmorgan-citigroup-hike-prime-rate-by-75-bps-mirroring-feds-move-2022-09-21/,https://www.reuters.com/resizer/faUjC7IpARZBEWIK7WcQpc6erbY=/1200x628/smart/filters:quality(80)/cloudfront-us-east-2.images.arcpublishing.com/reuters/ECDP36OXYJL2LHPICEHACUHYB4.jpg,2022-09-21T20:32:00Z,"Sept 21 (Reuters) - Three major U.S. banks said on Wednesday they will hike their prime lending rates by 75 basis points, bringing the rates to their highest since the global financial crisis of 2008… [+1788 chars]"
334,"{'id': 'reuters', 'name': 'Reuters'}",,Column: Profit or pivot? Funds blink on hawkish Fed bets - Reuters,"Hedge funds have slashed their record wager on rising U.S. interest rates by a quarter, but it remains to be seen whether this marks a turning point in their hawkish Fed outlook.",https://www.reuters.com/markets/rates-bonds/profit-or-pivot-funds-blink-hawkish-fed-bets-2022-09-12/,https://www.reuters.com/pf/resources/images/reuters/reuters-default.png?d=109,2022-09-12T08:31:00Z,"ORLANDO, Fla., Sept 12 (Reuters) - Hedge funds have slashed their record wager on rising U.S. interest rates by a quarter, but it remains to be seen whether this marks a turning point in their hawkis… [+3414 chars]"
335,"{'id': 'reuters', 'name': 'Reuters'}",,India's Aug retail inflation accelerates to 7% y/y after surge in food prices - Reuters,"India's retail inflation accelerated to 7% year-on-year in August, driven by a surge in food prices, adding pressure on the central bank to further hike interest rates later this month.",https://www.reuters.com/markets/asia/indias-aug-retail-inflation-accelerates-7-yy-after-surge-food-prices-2022-09-12/,https://www.reuters.com/resizer/rIfAwLGBsG6OHw825SefHT-hhTk=/1200x628/smart/filters:quality(80)/cloudfront-us-east-2.images.arcpublishing.com/reuters/7Q5LR53ODNILDOCZGHTZAID3UA.jpg,2022-09-12T12:25:00Z,"NEW DELHI, Sept 12 (Reuters) - India's retail inflation accelerated to 7% year-on-year in August, driven by a surge in food prices, adding pressure on the central bank to further hike interest rates … [+1798 chars]"
336,"{'id': 'reuters', 'name': 'Reuters'}",,Italy's right-wing bloc set for election win: five questions for markets - Reuters,"Italy's right-wing bloc looks set to win a majority in both houses of parliament in next Sunday's election, at a time when soaring energy prices and rising interest rates create growing challenges for the highly-indebted state.",https://www.reuters.com/markets/europe/italys-right-wing-bloc-set-election-win-five-questions-markets-2022-09-19/,https://www.reuters.com/resizer/LrELWUM_KH07Nwkpsogi9cN-Y0A=/1200x628/smart/filters:quality(80)/cloudfront-us-east-2.images.arcpublishing.com/reuters/IPNXT3YSPRJ25E25O7EI26PXQU.jpg,2022-09-19T06:20:00Z,"MILAN, Sept 19 (Reuters) - Italy's right-wing bloc looks set to win a majority in both houses of parliament in next Sunday's election, at a time when soaring energy prices and rising interest rates c… [+4653 chars]"
337,"{'id': 'reuters', 'name': 'Reuters'}",,Swedish c.bank surprises with full percentage point rate hike - Reuters,Sweden's central bank hiked interest rates by a full percentage point to 1.75% on Tuesday in surprise move and warned that more was to come as it sought to get to grips with surging inflation.,https://www.reuters.com/markets/rates-bonds/swedish-cbank-surprises-with-full-percentage-point-rate-hike-2022-09-20/,https://www.reuters.com/pf/resources/images/reuters/reuters-default.png?d=111,2022-09-20T07:44:00Z,"STOCKHOLM, Sept 20 (Reuters) - Sweden's central bank hiked interest rates by a full percentage point to 1.75% on Tuesday in surprise move and warned that more was to come as it sought to get to grips… [+1174 chars]"
338,"{'id': 'reuters', 'name': 'Reuters'}",,"There is a risk that UK ends up in a ""doom loop"" - economist Julian Jessop - Reuters.com","Economist Julian Jessop on Wednesday warned that Britain's economy could end up in a ""doom loop"" of falling currency and rising interest rates, but stressed that he believed recent market moves had been an over reaction.",https://www.reuters.com/markets/currencies/there-is-risk-that-uk-ends-up-doom-loop-economist-julian-jessop-2022-09-28/,https://www.reuters.com/resizer/hN4q_6IR1sJnazxt85Ua_PjmruM=/1200x628/smart/filters:quality(80)/cloudfront-us-east-2.images.arcpublishing.com/reuters/DJRGECTCEZINZPPFVROW6F4UDM.jpg,2022-09-28T07:41:51Z,"LONDON, Sept 28 (Reuters) - Economist Julian Jessop on Wednesday warned that Britain's economy could end up in a ""doom loop"" of falling currency and rising interest rates, but stressed that he believ… [+609 chars]"
